training_DisCo_3_high_random_holdout.csv

,phase,epoch,loss,accuracy,balanced-accuracy
0,train,0,7.071313762620123,0.6649230718612671,0.6677142229824921
1,val,0,6.734814965423479,0.6403371691703796,0.6603043857275385
2,train,1,6.282865730751426,0.7956905364990234,0.8009169527041637
3,val,1,6.550978604905351,0.682797372341156,0.6778204290327262
4,train,2,5.696669077368808,0.854945719242096,0.8584930802855402
5,val,2,6.654645049717141,0.7246331572532654,0.7158590300078483

train-results.md

hyper-parameters alpha: 1.0  beta: 0.8
Epoch 0/2
----------
train
Accuracy: 8517.0/12809
train Loss: 7.0713 Acc: 0.6649 Balanced-Acc: 0.6677
val
Accuracy: 2051.0/3203
val Loss: 6.7348 Acc: 0.6403 Balanced-Acc: 0.6603
Epoch 1/2
----------
train
Accuracy: 10192.0/12809
train Loss: 6.2829 Acc: 0.7957 Balanced-Acc: 0.8009
val
Accuracy: 2187.0/3203
val Loss: 6.5510 Acc: 0.6828 Balanced-Acc: 0.6778
New leading accuracy: 0.682797372341156
Epoch 2/2
----------
train
Accuracy: 10951.0/12809
train Loss: 5.6967 Acc: 0.8549 Balanced-Acc: 0.8585
val
Accuracy: 2321.0/3203
val Loss: 6.6546 Acc: 0.7246 Balanced-Acc: 0.7159
New leading accuracy: 0.7246331572532654
Training complete in 64m 53s
Best val Acc: 0.724633
Best model epoch: 2
Training Complete
gold