training_DisCoLmi_3_high_random_holdout.csv

,phase,epoch,loss,accuracy,balanced-accuracy
0,train,0,7.218474264120328,0.6647669672966003,0.6710242289208208
1,val,0,6.590367121730713,0.6484545469284058,0.6596539685136327
2,train,1,6.346344091711879,0.8006089329719543,0.8058758553788536
3,val,1,6.424815058447665,0.7549172639846802,0.6546285184932823
4,train,2,5.77159465687347,0.8601764440536499,0.8642221994238656
5,val,2,6.50924495760441,0.748673141002655,0.70150167743238

train-results.md

hyper-parameters alpha: 1.0  beta: 0.8 lam_mi: 1.0
Epoch 0/2
----------
train
Accuracy: 8515.0/12809
train Loss: 7.2185 Acc: 0.6648 Balanced-Acc: 0.6710
val
Accuracy: 2077.0/3203
val Loss: 6.5904 Acc: 0.6485 Balanced-Acc: 0.6597
Epoch 1/2
----------
train
Accuracy: 10255.0/12809
train Loss: 6.3463 Acc: 0.8006 Balanced-Acc: 0.8059
val
Accuracy: 2418.0/3203
val Loss: 6.4248 Acc: 0.7549 Balanced-Acc: 0.6546
New leading accuracy: 0.7549172639846802
Epoch 2/2
----------
train
Accuracy: 11018.0/12809
train Loss: 5.7716 Acc: 0.8602 Balanced-Acc: 0.8642
val
Accuracy: 2398.0/3203
val Loss: 6.5092 Acc: 0.7487 Balanced-Acc: 0.7015
Training complete in 121m 40s
Best val Acc: 0.754917
Best model epoch: 1
Training Complete
gold